Marital Status. A demographic parameter indicating a person's current conjugal status.	C6SezX_mKG
Marble Burying test - percent object buried count. Percent object buried (2/3 or marble below top of bedding) to object not buried , as part of Marble Burying test	XkY_Kizo4
Marble Burying test - Marble Diameter value. Value of marble diameter (in centimeters) , as part of Marble Burying test	X1BPKoMoV
Marble Burying test - Arena size height value. Value of height of test arena (in centimeters) , as part of Marble Burying test	m1_wKiMs4
Marble Burying test - Marble count. Number of marbles used , as part of Marble Burying test	7kIPKiGjN
Marble Burying test - Marble Equidistant Spacing Indicator. Indicator if equidistant spacing of marbles was used , as part of Marble Burying test	m1uDFifsV
Marble Burying test - Depth of bedding value. Value of depth of bedding (in centimeters) , as part of Marble Burying test	Q1zwtjzo4
Marble Burying test - Arena size length value. Value of length of test arena (in centimeters) , as part of Marble Burying test	X1kPYifoN
Marble Burying test - Arena size width value. Value of width of test arena (in centimeters) , as part of Marble Burying test	Qya8FofjN
How many times in the last year have you been paid for having sexual relations with someone [Denver Youth Survey]. 	7Jdgotqs2sx
Laboratory procedure glycosylated hemoglobin value. Subject/Particpants amount of Glycosylated Hemoglobin (Hemoglobin A1c) in the blood.	7JXGK79sHR
Animal stabilization surface material type. Type of material properties of the surface on which the animal lies	X9MmQ1Oq
Over the past 4 weeks when you had sexual stimulation or intercourse, how often did you ejaculate [PhenX]. 	mkIxdcohoe
Conditioned Place Preference Test equipment compartment Illumination level value. Level of illumination in the compartment of the Conditioned Place Preference equipment in lumes	XkxOuoMsE
Over the past 4 weeks when you had sexual stimulation or intercourse, how often did you have the feeling of orgasm or climax [PhenX]. 	myDed9inox
How many times in the last year have you had or tried to have sexual relations with someone against their will, other than events you just mentioned [Denver Youth Survey]. 	my9loFqo3jg
Site name. The name of the site for the study	ZtTACudtFcK
Sexual Orientation - Specify. The pattern of a person's emotional, romantic, and/or sexual attractions, not described in initial value selection list or secondary value selection list	dvEQ3Mi5w2
FEV1/FEV6 Predicted. 	7JqlW99i2og
FEV1/FVC Predicted. 	mkFl_c5s3jl
FEV1 Predicted. 	71PxW95i2sx
FEV1. 	Qkxe_ccohjx
FEV1 measured/predicted. 	XkMKL5o3ig
FEV1 --post bronchodilation. 	XypeOIcjnie
FEV1 --pre bronchodilation. 	7JKgOU5shie
Subject ID. Subject identification ID	Qyw98XerAz
Health Conditions - Disease Disorders. A state of being, such as a state of health.C25457  | Any abnormal condition of the body or mind that causes discomfort, dysfunction, or distress to the person affected or those in contact with the person. The term is often used broadly to include injuries, disabilities, syndromes, symptoms, deviant behaviors, and atypical variations of structure and function.C2991	hbgYw7HPpXW
Health Conditions - Medication or Other Treatments. A drug product that contains one or more active and/or inactive ingredients; it is intended to treat, prevent or alleviate the symptoms of disease. This term does not refer to the individual ingredients that make up the product.	mJEKBtpuQDH
